offense,group
"TRANSPORTATION NETWORK, DRIVER PROVIDE DRIVER ID TO ANOTHER , FIRST OFFENSE  c. 159A 1/2 § 7(b)",Other
"TRANSPORTATION NETWORK, DRIVER PROVIDE DRIVER ID TO ANOTHER , SECOND OFFENSE c. 159A 1/2 § 7(b)",Other
"METHAMPHETAMINE, POSSESS TO DISTRIB c94C §32A(c)",Other
"TRANSPORTATION NETWORK, DRIVER  PROVIDE DRIVER ID TO ANOTHER , SECOND OFFENSE c. 159A 1/2 § 7",Other
"PUPIL TRANSP SAFETY, FAIL TEACH, 2ND OFF c90 §7D",Other
"METHAMPHETAMINE, TRAFFICKING IN  100 GRAMS OR MORE, LESS THAN 200 GRAMS  c94C §32E(b)",Other
"HEROIN/MORPHINE/OPIUM, TRAFFICKING IN 100 GRAMS OR MORE, LESS THAN 200 GRAMS c94C §32E(c)",Drugs
"BOAT OUI--LIQUOR OR .08%, 3RD OFFENSE c90B §8(a)",OUI
"BOAT OUI--LIQUOR OR .08%, 4TH OFFENSE c90B §8(a)",OUI
"IGNITION INTERLOCK FOR ANOTHER, BYPASS, SUBSQ. OFF. c90 §24U(a)(1)",Other
SNOW/REC VEH--UNDER 16½ CROSS HIGHWAY c90B §26,Other
"METHAMPHETAMINE, TRAFFICKING IN 200 GRAMS OR MORE  c94C §32E(b)",Other
"DRUG, DISTRIBUTE CLASS C, SUBSQ.OFF. c94C §32B(b)",Drugs
"OUI--DRUGS, 9TH OFFENSE c90 §24(1)(a)(1)",Drugs
"ELECTRONIC DEVICE, USE WHILE OPERATING MV, 1ST OFFENSE* c90 §13B",Phone Use
"AMPHIBIOUS SIGHT-SEEING VEHICLE, OPERATE WHILE GUIDING, SUBSQ OFF   c. 90 §13C",Other
"PEDESTRIAN VIOLATION, 4TH OFFENSE c90 §18A",Traffic Violation
"TOBIN BRIDGE - TOLL, USE DEVICE TO EVADE * 700 CMR §11.04(5)",Other
"MARIHUANA, TRAFFICKING IN 2000 POUNDS OR MORE BUT LESS THAN 10,00 POUNDS c94C §32E(a)",Drugs
"AMPHIBIOUS SIGHT-SEEING VEHICLE, OPERATE W/OUT SAFETY EQUIPMENT c. 90 §13C",Other
"TIRES, SELL NONCONFORM RETREAD c90 §7M",Other
"OUI--DRUGS, 7TH OFFENSE c90 §24(1)(a)(1)",Drugs
"DRIVER OF TRANSPORT NETWORK, FAIL COMPLY WITH DECAL REQ  G.L. c. 159A1/2 § 2(b)  c. 159A 1/2 § 7(a)",Other
"TRANSPORTATION NETWORK, DRIVER PROVIDE DRIVER ID TO ANOTHER, 3RD OR SUBSQ OFFENSE c.159A 1/2 § 7(b)",Other
"BRAKE DRUMS, NONCONFORMING USED c90 §7G",Other
"DRIVER OF TRANSPORT NETWK, FAIL COMPLY WITH DRIVER CERT REQ OF G.L. c.159A1/2 § 4 c. 159A 1/2 § 7(a)",Other
"TRANSPORTATION NETWORK, DRIVER FAIL COMPLY WITH DECAL REQ  G.L. c.159A1/2 § 2(b)  c.159A 1/2 § 7(a)",Other
"TRANSPORTATION NETWO, DRIVER FAIL COMPLY WITH DRIVER CERT REQ OF G.L.c.159A1/2 § 4 c.159A 1/2 § 7(a)",Other
"EQUIPMENT, SELL NONCONFORM MV, 3RD OFF. c90 §7",Other
"EMISSIONS, ATT REGISTER MV WITH IMPROPER c90 §2",Other Registration Violation
"EQUIPMENT, SELL NONCONFORM MV, 2ND OFF. c90 §7",Other
"TRANSPORT NETWORK, DRIVER FAIL PROVIDE DRIVER ID TO LAW ENFORCE, 3RD OR SUBSQ OFF c. 159A 1/2 § 7(d)",Other
"ELECTRONIC DEVICE, USE WHILE OPERATING MV, 3RD OR SUBSQ OFFENSE* c90 §13B",Phone Use
"ELECTRONIC DEVICE, USE WHILE OPERATING MV, 2ND OFFENSE* c90 §13B",Phone Use
"DRIVER OF TRANSPORTATION NETWORK, FAIL COMPLY WITH INSUR REQ OF G.L. c.159A1/2 § 5 c.159A 1/2 § 7(a)",Uninsured
"TRANSPORTATION NETWORK, DRIVER FAIL COMPLY WITH INSUR REQ OF G.L. c. 159A1/2 § 5 c. 159A 1/2 § 7(a)",Uninsured
STATE LIMITED ACCESS HWAY--HORSE 720 CMR §9.08,Other
"AMPHIBIOUS SIGHT-SEEING VEHICLE, OPERATE WHILE GUIDING  c. 90 §13C",Other
"MOTOR VEH WITH DEFACED VIN, ATT TO SELL c266 §139(b)",Other
"OUI--DRUGS, 6TH OFFENSE c90 §24(1)(a)(1)",Drugs
HANDICAP PARKING PLATE/PLACARD FALSE STMT * c90 §2,Other
USED CAR DEALER FAIL REMOVE PLATES c140 §67A,Other
"INSPECTION, UNLICENSED MV c90 §7W",Inspection
"TRUCK TIRE RIMS, IMPROP SERVICING OF c90 §9C",Other
"METHAMPHETAMINE, TRAFFICKING IN  36 GRAMS OR MORE, LESS THAN 100 GRAMS  c94C §32E(b)",Other
"DRUG, DISTRIBUTE CLASS E, SUBSQ.OFF. c94C §32D(b)",Drugs
"TRANSPORT NETWORK, DRIVER USE ID OF ANOTHER OR MISREPRESENT ID, SECOND OFFENSE c. 159A 1/2 § 7(b)",Other
VOC STUDENT TRANSPORT VIOLATION * c90 §7D½,Other
LEASE MV WITHOUT SEEING DRIVERS LICENSE c90 §32C,Other License Violation
"CRUSHING MACHINE, UNREGISTERED MV c90 §24H",No Registration
