offense,group
OUI--LIQUOR c90 §24(1)(a)(1),OUI
"STOP/YIELD, FAIL TO * c89 §9",Fail to stop/yield/slow/signal
SPEEDING * c90 §17,Speeding
RECKLESS OPERATION OF MOTOR VEHICLE c90 §24(2)(a),Reckless Driving
"KEEP RIGHT ON HILL/OBSTRUCTED VIEW, FL * c89 §4",Traffic Violation
REGISTRATION NOT IN POSSESSION * c90 §11,No Registration
"INSPECTION/STICKER, NO * c90 §20",Inspection
UNREGISTERED MOTOR VEHICLE * c90 §9,No Registration
"NAME/ADDRESS CHANGE, FL NOTIFY RMV OF * c90 §26A",Other
"LICENSE REVOKED AS HTO, OPERATE MV WITH c90 §23",Other License Violation
"IMPROPER OPERATION OF MV, ALLOW * c90 §12",Other
WEIGHT VIOLATION * c90 §19A & §20,Other
"SLOW, FAIL TO * c90 §14",Fail to stop/yield/slow/signal
MARKED LANES VIOLATION * c89 §4A,Improper Lane Change
UNLICENSED OPERATION OF MV c90 §10,No License
"LIQUOR, PERSON UNDER 21 POSSESS c138 §34C",Alcohol
MISCELLANEOUS MUNIC MOTOR VEHICLE ORDINANCE/BYLAW VIOL,Miscellaneous Violation
SPEEDING IN VIOL SPECIAL REGULATION * c90 §18,Speeding
"EQUIPMENT VIOLATION, MISCELLANEOUS MV * c90 §7",Equipment Violation
USE MV WITHOUT AUTHORITY c90 §24(2)(a),Other
"LICENSE RESTRICTION, OPERATE MV IN VIOL",Other License Violation
NUMBER PLATE STICKER NOT DISPLAYED 540 C,License Plate
LEAVE SCENE OF PROPERTY DAMAGE c90 §24(2)(a),Property Damage
NUMBER PLATE VIOLATION TO CONCEAL ID c90 §23,License Plate
UNINSURED MOTOR VEHICLE c90 §34J,Uninsured
"LICENSE SUSPENDED, OP MV WITH c90 §23",Suspended/Revoked License
STATE HWAY--SIGNAL/SIGN/MARKINGS VIOL * 720 CMR §9.06,Fail to stop/yield/slow/signal
"REGISTRATION SUSPENDED, OP MV WITH c90 §23",Suspended Registration
"YIELD AT INTERSECTION, FAIL * c89 §8",Fail to stop/yield/slow/signal
NEGLIGENT OPERATION OF MOTOR VEHICLE c90 §24(2)(a),Unsafe/Negligent Operation
"STOP FOR POLICE, FAIL c90 §25",Disobey Police
"RIGHT LANE, FAIL DRIVE IN * c89 §4B",Traffic Violation
"KEEP RIGHT FOR ONCOMING MV, FAIL TO * c89 §1",Other
MOTOR VEH BY-LAW VIOLATION * c85 §10,Other
"MOTOR VEH THIEF, CONCEAL c266 §28(b)",Other
OUI--DRUGS c90 §24(1)(a)(1),Drugs
"OPERATION OF MOTOR VEHICLE, IMPROPER * c90 §16",Equipment Violation
"SEAT BELT, FAIL WEAR * c90 §13A",Seatbelt
NUMBER PLATE VIOLATION * c90 §6,License Plate
"DRUG, POSSESS CLASS D c94C §34",Drugs
WINDOW OBSTRUCTED/NONTRANSPARENT * c90 §9D,Equipment Violation
"SIGNAL, FAIL TO * c90 §14B",Fail to stop/yield/slow/signal
"RMV DOCUMENT, POSSESS/USE FALSE/STOLEN c90 §24B",Other
CHILD 5-12 WITHOUT SEAT BELT * c90 §7AA,Seatbelt
UNSAFE OPERATION OF MV * c90 §13,Unsafe/Negligent Operation
MOTOR CARRIER SAFETY VIOLATION 540 CMR §14.03,Other
"RED/BLUE LIGHT VIOLATION, MV * c90 §7E",Lights Violation
"ALCOHOL IN MV, POSSESS OPEN CONTAINER OF * c90 §24I",Alcohol
REGISTRATION STICKER MISSING * 540 CMR §2.05(6)(a),Other Registration Violation
MASS PIKE--SPEEDING * 730 CMR §7.08(6)(a),Speeding
"DRUG, POSSESS CLASS A c94C §34",Drugs
TRESPASS WITH MOTOR VEHICLE * c266 §121A,Other
RAILROAD CROSSING VIOLATION * c90 §15,Other
CROSSWALK VIOLATION * c89 §11,Traffic Violation
"SAFETY STANDARDS, MV NOT MEETING RMV * c90 §7A & §20",Other
RACING MOTOR VEHICLE * c90 §17B,Other
PASSING VIOLATION * c89 §2,Traffic Violation
STATE HWAY--WRONG WAY * 720 CMR §9.05,Other
"LIGHTS VIOLATION, MV * c90 §7",Lights Violation
"EMERGENCY VEHICLE, OBSTRUCT * c89 §7A",Obstruct Emergency Vehicle
"LIGHTS, FAIL DIM 540 CMR §2.12",Lights Violation
"HYPODERMIC FOR DRUGS, UNLICENSED SALE OF c94C §27",Drugs
"DRUG, POSSESS CLASS B c94C §34",Drugs
"DRUG, POSSESS CLASS C c94C §34",Drugs
LIGHTS VIOLATION * c85 §15,Lights Violation
TRUCK FAIL DISPLAY OWNERS NAME * 540 CMR §2.22(1),Other
TIRE TREAD DEPTH VIOLATION * c90 §7Q,Other
"HEADLIGHTS, FAIL DIM * 540 CMR §22.05(2)",Lights Violation
"DRUG, POSSESS CLASS E, SUBSQ. OFF. c94C §34",Drugs
"MASS PIKE--INSPECTION STICKER, NO *   730 CMR §7.08(26)",Inspection
"MASS PIKE--SIGN, FAIL OBEY * 730 CMR §7.08(1)(a)",Sign/Signal/Light Violation
RULES/REG VIOLATION,Other
ABANDON MV c90 §22B(a),Other
"LICENSE, EXHIBIT ANOTHERS c90 §23",Other License Violation
"DRUG, POSSESS TO DISTRIB CLASS B c94C §32A(a)",Drugs
"DRUG, POSSESS TO DISTRIB CLASS C c94C §32B(a)",Drugs
"PRESCRIPTION, UTTER FALSE c94C §33(b)",Other
CONSPIRACY TO VIOLATE DRUG LAW c94C §40,Drugs
LEFT LANE RESTRICTION VIOLATION * c89 §4C,Traffic Violation
"ACCIDENT REPORT, FAIL FILE * c90 §26",Other
SCHOOL BUS OPERATION/EQUIPMENT VIOL * c90 §7B,Equipment Violation
LEARNERS PERMIT VIOLATION * c90 §8B,Other
"NUMBER PLATE, MISUSE OFFICIAL * c90 §2",License Plate
"TRASH, LITTER FROM MV c270 §16",Other
LOAD UNSECURED/UNCOVERED * c85 §36,Other
LEAVE SCENE OF PERSONAL INJURY c90 §24(2)(a½)(1),Other
"SNOW/REC VEH--REGISTRATION, FL PRODUCE * c90B §22",Other
MASS PIKE--MOTOR CARRIER SAFETY ACT VIOL * 730 CMR §7.09,Other
"LICENSE, FALSE STATEMENT IN APPLIC FOR c90 §24(2)(a)",Other License Violation
"LIQUOR LICENSING AUTH, REFUSE ID SELF TO c138 §34B",Alcohol
"OVERWEIGHT PERSONAL PROPERTY, CONVEY * 540 CMR §2.22(2) or (3)",Other
"SCHOOL BUS, FAIL STOP FOR * c90 §14",Other
JUNIOR OPERATOR WITH PASSENGER UNDER 18 * c90 §8,Other
OVERSIZE MV * c90 §19,Other
TIRE OUTSIDE FENDER c90 §19,Other
"STATE HWAY--CLOSED TO TRAVEL, MV WHERE * c85 §2E",Other
MASS PIKE—WEIGHT VIOLATION 730 CMR §5.04,Other
"MASS PIKE--FUEL, INADEQUATE *  730 CMR §7.08(23)",Other
MASS PIKE--WEIGHT VIOLATION * 730 CMR §7.05(5)(h),Other
JUNIOR OPERATOR OP 12-5 AM W/O PARENT c90 §§8 & 10,Other
"DRUG, POSSESS TO DISTRIB CLASS D c94C §32C(a)",Drugs
DRUG VIOLATION NEAR SCHOOL/PARK c94C §32J,Drugs
"DRUG, POSSESS TO DISTRIB CLASS A c94C §32(a)",Drugs
"COCAINE, POSSESS TO DISTRIBUTE c94C §32A(c)",Drugs
"DRUG, LARCENY OF c94C §37",Drugs
IDLE ENGINE OF STOPPED MV OVER 5 MINUTES * c90 §16A,Other
MASS PIKE SPEEDING 730 CMR §5.04,Speeding
"SNOW/REC VEH--STOP FOR POLICE, FAIL * c90B §32",Other
"SNOW/REC VEH--PUBLIC WAY, ON c90B §25",Other
STUDENT MOTOR VEH REGISTRATION VIOL * c90 §3,Other Registration Violation
MOTOR VEH INSPECTION STATION VIOLATION 540 CMR §4.00,Inspection
REGISTER MV IMPROPERLY TO AVOID TAXES/PREMIUMS * c90 §3½(c)(¶2),Other Registration Violation
MASS PIKE--$50 VIOLATION * 730 CMR §5.04,Other
"CIGARETTE/MATCH, DROP ON FOREST/FIELD c148 §54",Other
STATE LIMITED ACCESS HWAY--BICYCLE 720 CMR §9.08,Other
"NUMBER PLATE, FALSE APPLIC FOR DEALER c90 §5(g)",License Plate
FLARES VIOLATION BY COMMERCIAL VEHICLE * c85 §14B,Other
"MOTOR VEH, MALICIOUS DAMAGE TO c266 §28(a)",Other
"DRUG, POSSESS TO DISTRIB CLASS A, SUBSQ. c94C §32(b)",Drugs
"COCAINE, TRAFFICKING IN c94C §32E(b)",Drugs
OUI--LIQUOR & SERIOUS INJURY c90 §24L(2),OUI
TOBIN BRIDGE—TRAFFIC VIOLATION 740 CMR §,Traffic Violation
TOBIN BRIDGE—SPEEDING OVER POSTED LIMIT,Speeding
"HEROIN/MORPHINE/OPIUM, TRAFFICKING IN 18 GRAMS OR MORE, LESS THAN 36 GRAMS c94C §32E(c)",Drugs
"DRUG PARAPHERNALIA, DISTRIBUTE c94C §32I(a)",Drugs
"COUNTERFEIT DRUG, POSSESS TO DISTRIBUTE c94C §32G",Drugs
SNOW/REC VEH--UNREGISTERED * c90B §21,Other
SNOW/REC VEH--UNSAFE OPERATION * c90B §26,Other
MDC WAY--SPEEDING * 350 CMR §4.01,Speeding
SNOW/REC VEHICLE VIOLATION * 323 CMR §3.03,Other
SNOW/REC VEH--EQUIPMENT VIOLATION * c90B §24,Other
"DRUG, POSSESS TO DISTRIB CLASS E c94C §32D(a)",Drugs
"SNOW/REC VEH--ACCIDENT, FAIL REPORT * c90B §27",Other
"MASS PIKE—TOLL, EVADE 730 CMR §5.03",Other
TIRE WIDTH BY-LAW VIOLATION * c40 §21(9),Other
LICENSE NOT IN POSSESSION * c90 §11,No License
SUMNR/CALHN TUNL—SPEEDING 730 CMR §3.05,Speeding
STATE HWAY--PARKING * 720 CMR §9.03,Other
HAZARDOUS MATERIALS TRANSPORT VIOL *  540 CMR §14.03,Other
"DRUG, POSSESS TO DISTRIB CLASS B, SUBSQ. c94C §32A(b)",Drugs
"FALSE PRESCRIPTION, PHARMACIST KNOWINGLY FILL CLASS A  c94C §19(a)",Other
"NAME/ADDRESS, MV OP REFUSE GIVE AT NT * c85 §16",Disobey Police
"SPECIAL FUELS, USE WITHOUT LICENSE * c64E §2",Other
"BLIND PEDESTRIAN, FAIL STOP FOR * c90 §14A",Traffic Violation
"HEIGHT, OPERATE MV WITH MODIFIED * c90 §7P",Other
"REGISTER MV OPERATED +30 DAYS YEAR, FL * c90 §3",Other Registration Violation
PEDESTRIAN VIOLATION c90 §18A,Traffic Violation
"HYPODERMIC, POSSESS c94C §27(a)",Other
MOTOR VEH IN AREA CLOSED TO TRAVEL * c90 §18,Other
"MASS PIKE--ETC TOLL, AVOID * 730 CMR §7.04(3)",Other
"MASS PIKE--TOLL, EVADE *  730 CMR §7.03(4)",Other
"LIQUOR, ASSIST PERSON UNDER 21 PURCHASE c138 §34A",Alcohol
MOTOR VEH HOMICIDE BY NEGLIGENT OP c90 §24G(b),Death
MANSLAUGHTER c265 §13,Death
MDC WAY--$200 VIOLATION * 350 CMR §4.01,Other
LEAVE SCENE OF PERSONAL INJURY & DEATH c90 §24(2)(a½)(2),Other
MOTOR VEH HOMICIDE BY RECKLESS OP c90 §24G(b),Death
MOTOR VEH HOMICIDE OUI--LIQUOR & NEGLIG c90 §24G(a),Death
"MDC WAY/RESERV--ENTRY/EXIT, IMPROPER MV * 350 CMR §2.01(2)",Other
"MASS PIKE--HEIGHT CLEARANCE, FAIL CHECK *  730 CMR §7.06(4)(g)",Other
"HEROIN, BEING PRESENT WHERE KEPT c94C §35",Drugs
WEIGHT VIOLATION ON STATE HWAY * c85 §30,Other
MASS PIKE--WEIGHT VIOLATION * c81A §19,Other
MDC WAY--$25 VIOLATION * 350 CMR §4.01,Other
MASS PIKE--OVERWEIGHT CONSTR VEH W/O PERMIT *  730 CMR §7.06(3)(c)(2),Other
"COCAINE, POSSESS TO DISTRIBUTE, SUBSQ. c94C §32A(d)",Drugs
"MOTOR VEH IN FELONY/LARCENY, USE c90 §24A",Other
"LICENSE SUSPENDED FOR OUI, OPER MV WITH c90 §23",OUI
"MOTOR VEH VIN, REMOVE/ALTER c266 §139(a)",Other
"TOBIN BRIDGE—TOLL, EVADE 740 CMR §11.03",Other
"MASS PIKE--TOLL BOOTH, FAIL STOP AT *  730 CMR §7.03(2)",Other
"DRUG, POSSESS TO DISTRIB CLASS D, SUBSQ. c94C §32C(b)",Drugs
MASS PIKE--PARKING $15 VIOLATION * 730 CMR §7.08(3)&(4),Other
MASS PIKE--HAZARDOUS MATERIAL VIOLATION * 730 CMR §7.10,Other
STATE HWAY—HAZARDOUS MATERIAL TRANS VIOL,Other
SUMNR/CALHN TUNL--$50 VIOLATION * 730 CMR §3.05,Other
MOPED VIOLATION * c90 §1B,Other
"UNLICENSED/SUSPENDED OPERATION OF MV, PERMIT  c90 §12(b)",No License
WEIGHT VIOL ON STATE HWAY & NO STICKER * c85 §30A,Other
SCHOOL BUS EQUIP VIOLATION 540 CMR §7.00,Other
MOTORCYCLE HANDLEBAR VIOLATION * 540 CMR §4.06(5)(e),Other
MASS PIKE--COMMON CARRIER FL STOP FOR POLICE *  730 CMR §7.08(30),Disobey Police
"MOTOR VEH, RECEIVE STOLEN c266 §28(a)",Other
"LICENSE, ALLOW ANOTHER TO USE c90 §24(2)(a)",Other License Violation
"EMERGENCY VEHICLE, WILFULLY OBSTRUCT c89 §7",Obstruct Emergency Vehicle
MDC WAY--$50 VIOLATION * 350 CMR §4.01,Other
MASS PIKE--TANDEM GROSS WEIGHT VIOL * 730 CMR §7.07(4)&(5),Other
PUPIL TRANSPORT VEHICLE VIOLATION * c90 §7D,Other
SAFETY GLASS VIOLATION * c90 §9A,Other
WEIGHT VIOLATION ON HWAY BRIDGE * c85 §35,Other
"HIRING VEHICLE, FRAUD IN c266 §64",Other
"DRUG, OBTAIN BY FRAUD c94C §33(b)",Drugs
WEIGHT CERTIFICATE VIOLATION * c90 §19D,Other
SUMNR/CALHN TUNL—$100 VIOLATION 730 CMR,Other
"NUMBER PLATE, MISUSE DEALER/REPAIR 540 CMR §18.04(2)",License Plate
"TITLE, FAIL APPLY FOR MV c90D §4(a)",Other
LOGAN--SIGNAL/SIGN/MARKINGS VIOLATION * 740 CMR §21.52,Fail to stop/yield/slow/signal
STATE HWAY-TRAFFIC VIOLATION * 720 CMR §9.06,Traffic Violation
MASS PIKE--TANDEM SPEED VIOLATION * 730 CMR §7.07(19),Other
"SCHOOL BUS INSTRUCTOR, UNLIC c90 §8A",Other
"TIRES, SELL NONCONFORMING c90 §7K",Other
TAGGING PROPERTY c266 §126B,Other
"ANIMAL, TRANSPORT UNPROTECTED * c90 §22H",Other
LEASE MOTORCYCLES WITHOUT LICENSE c90 §32H,Other License Violation
VEHICLE ID NUMBER NOT DISPLAYED * c90 §7R,Other
MASS PIKE—$100 VIOLATION 730 CMR §5.04,Other
MOTOR VEH HOMICIDE OUI--DRUGS & NEGLIG c90 §24G(a),Death
"POLLUTANT CONTROL DEVICE, REMOVE c90 §7O",Other
SUMNR/CALHN TUNL—$20 VIOLATION 730 CMR §,Other
"OUI--LIQUOR, 2ND OFFENSE c90 §24(1)(a)(1)",OUI
"MOTOR VEH, LARCENY OF c266 §28(a)",Other
"DRUG, PRACTITIONER FAIL LABEL c94C §22(b)",Drugs
MOTOR VEH HOMICIDE OUI--DRUGS c90 §24G(b),Death
"FUNERAL PROCESSION, DISTURB c272 §42",Other
"DOG/CAT, MOTORIST FL REPORT INJURY TO * c272 §80H",Other
MOTOR VEH HOMICIDE OUI--LIQUOR c90 §24G(b),Death
TRESPASS c266 §120,Other
"DRUG, POSSESS TO DISTRIB CLASS C, SUBSQ. c94C §32B(b)",Drugs
WEIGHT VIOLATION ON MUNICIPAL WAY * c85 §30,Other
"DRUG PARAPHERNALIA, SELL TO MINOR c94C §32I(b)",Drugs
SPECIAL NEEDS STUDENTS VEH FL ID OWNER * c90 §7CC,Other
VANDALIZE PROPERTY c266 §126A,Other
MOTOR VEH HOMICIDE OUI--LIQUOR & RECKL c90 §24G(a),Death
"MOTORCYCLE, NOISY * c90 §7U",Other
MASS PIKE TANDEM—LENGTH VIOLATION 730 CM,Other
LOGAN--CARRIER VIOLATION * 740 CMR §21.53,Other
LEASE MV LESSEE ALLOW UNAUTH PERSON OP c90 §32E,Other
"TITLE, FALSE MV c90D §32(a)",Other
RMV ID CARD FRAUD c90 §8H,Other
"NUMBER PLATE, MISUSE MILITARY * c90 §5A",License Plate
ALTER MOTOR VEH TO REDUCE GVW c90 §19D,Other
"IDENTIFY SELF, MV OPERATOR REFUSE c90 §25",Disobey Police
LOGAN--SPEEDING OVER POSTED LIMIT * 740 CMR §21.51,Speeding
"MARIHUANA, TRAFFICKING IN 50 POUNDS OR MORE BUT LESS THAN 100 POUNDSc94C §32E(a)",Drugs
"DRUG, DISTRIBUTE CLASS D c94C §32C(a)",Drugs
"LIQUOR, PERSON UNDER 21 ATTEMPT PROCURE c138 §34A",Alcohol
MASS PIKE—DROP DANGEROUS ITEM ON PIKE 73,Other
SNOW/REC VEH--TRANSFER UNREPORTED * c90B §23,Other
"LICENSE CLASS, OPERATE MV IN VIOLATION c90 §10",Other License Violation
MOTOR VEH HOMICIDE OUI--DRUGS & RECKLESS c90 §24G(a),Death
WEIGHT VIOLATION IN VIOL FEDERAL LAW * c90 §19E,Other
WEIGHT VIOL ON MUNIC WAY & NO STICKER * c85 §30A,Other
MASS PIKE - SPEEDING * 700 CMR §7.08(6)(a),Speeding
"DRUG, POSSESS CLASS D, SUBSQ.OFF. c94C §34",Drugs
"BRAKES VIOLATION, MV * c90 §7",Other
SAMARITAN VEHICLE MISUSE SIREN/LIGHT * c90 §7I,Lights Violation
DRIVING SCHOOL VIOLATION 540 CMR §2.28,Other
LEASE MV TO INTOXICATED DRIVER c90 §32C,Other
WEIGHT VIOLATION ON COUNTY WAY * c85 §30,Other
"SUMNR/CALHN TUNL—TOLL, EVADE 730 CMR §3.",Other
"DRUG, POSSESS TO DISTRIB CLASS E, SUBSQ. c94C §32D(b)",Drugs
NUMBER PLATE MISSING * c90 §9,License Plate
"WEIGHED, REFUSAL TO BE * c90 §19A",Other
"DRUG, POSSESS TO DISTR TO MINOR CLASS A c94C §32F(a)",Drugs
"AFTERMARKET LIGHTING, NONCOMPLIANT * 540 CMR §22.07",Lights Violation
"LICENSE SUSPENDED, OP MV WITH, SUBSQ.OFF c90 §23",Suspended/Revoked License
BOAT OUI--DRUGS c90B §8(a),Drugs
"TURN, IMPROPER * c90 §14",Fail to stop/yield/slow/signal
MASSPORT--TRAFFIC VIOLATION * 740 CMR §3.03,Traffic Violation
MOTORCYCLE EQUIPMENT VIOLATION * c90 §7,Equipment Violation
"ABANDONED MV, VANDALIZE c90 §22E",Other
MASS PIKE--DISABLED VEH REPAIR/TOW VIOL *  730 CMR §7.11,Other
SOLICIT FROM PERSONS IN MOTOR VEHICLES c85 §17A,Other
SNOW/REC VEH--OUI--LIQUOR * c90B §26,OUI
SNOW/REC VEH--HELMET VIOLATION * c90B §26,Other
CHILD UNDER 5 WITHOUT CARSEAT * c90 §7AA,Other
"DRUG FUNDS, CAUSE MINOR TO POSSESS c94C §32K",Drugs
WEIGHT VIOLATION WITH IRREDUCIBLE LOAD * c90 §19A & §20,Other
MASS PIKE TUNNELS--$500 VIOLATION * 730 CMR §3.06,Other
BREAKDOWN LANE VIOLATION * c89 §4B,Traffic Violation
MASS PIKE--SPEEDING OVER POSTED LIMIT *  730 CMR §7.08(6)(c),Speeding
"EMERGENCY VEHICLE, WILFULLY OBSTRUCT, 2D c89 §7",Obstruct Emergency Vehicle
SPEEDING ON COUNTY BRIDGE VIOL BY-LAW * c85 §20,Speeding
STATE HWAY--FITZGERALD TUNL HAZARD MATS * 720 CMR §9.08,Other
OUT-OF-SVCE ORDER VIOLATION * c90F §9(E½)(3),Other
"OUT-OF-SVCE ORDER VIOL, EMPLOYER PERMIT * c90F §4(C)",Other
BICYCLE VIOLATION c85 §11B,Other
"SIGN NAME, MV OPERATOR REFUSE c90 §25",Disobey Police
MASSPORT--SPEEDING OVER POSTED LIMIT * 740 CMR §3.03,Speeding
"PUPILS, TRANSPORT WITHOUT LICENSE * c90 §8A½",Other
"OUI-LIQUOR, 3RD OFFENSE c90 §24(1)(a)(1)",OUI
SCHOOL BUS OPERATE WITH STANDEES * c90 §7L,Other
"ALL TERRAIN/REC UTILITY VEH, UNDERAGE OP c90B §26(a)",Other
"DRUG INSPECTION, REFUSE c94C §25(6)",Drugs
RACING MOTOR VEHICLE c90 §24(2)(a),Other
SNOW/REC VEH - REFUSE STOP FOR POLICE * c90B §26(c),Other
MASS PIKE--NEGLIGENT OPERATION * 730 CMR §7.08(5)(a),Unsafe/Negligent Operation
"HEROIN/MORPHINE/OPIUM, TRAFFICKING IN c94C §32E(c)",Drugs
MOPED OPERATION BY UNLIC -17 c90 §1B,Other
BOAT OUI--LIQUOR & SERIOUS INJURY c90B §8A(2),OUI
MASS PIKE--WEIGHT VIOL WHILE SPEEDING • c81A §19,Speeding
"COMMON CARRIER INTERSTATE PLATE, MISUSE c159B §10",Other
"OUI-LIQUOR, 2ND OFFENSE c90 §24(1)(a)(1)",OUI
OUI-LIQUOR OR .08% c90 §24(1)(a)(1),OUI
OUI--LIQUOR OR .08% & SERIOUS INJURY c90 §24L(2),OUI
"ANIMAL, TRANSPORT DANGEROUS WILD * c85 §19",Other
"DRUG, FALSE REGIS NUMBER FOR c94C §33(a)",Drugs
"ABANDONED/STOLEN MV, IMPROP REMOVE c90 §24H",Other
"DRUG, DISTRIBUTE CLASS A c94C §32(a)",Drugs
"DRUG, DISTRIBUTE CLASS A, SUBSQ.OFF. c94C §32(b)",Drugs
"HYPODERMIC, POSSESS, SUBSQ.OFF. c94C §27(a)",Other
HANDICAP PARKING PLATE/PLACARD MISUSE * c90 §2,Other
MOTOR VEH HOMICIDE OUI--LIQUOR OR .08% & RECKLESS c90 §24G(a),Death
MOTOR VEH HOMICIDE OUI--LIQUOR OR .08% & NEGLIGENT c90 §24G(a),Death
DRIVING SCHOOL EQUIPMENT VIOLATION * c90 §32G,Equipment Violation
MASS PIKE—$15 VIOLATION 730 CMR §5.04,Other
"OUI-LIQUOR OR .08%, 2ND OFFENSE c90 §24(1)(a)(1)",OUI
MASS PIKE--TOO CLOSE *  730 CMR §7.08(15),Traffic Violation
"PUPIL TRANSPORT VEHICLE, OVERCROWDED c90 §7D",Other
MASS PIKE--PASSING VIOLATION *  730 CMR §7.08(14),Traffic Violation
BICYCLE VIOLATOR REFUSE IDENTIFY SELF c85 §11E,Disobey Police
LOGAN--CARRIER $50/$100/$200 VIOLATION * 740 CMR §23.03,Other
"OUI-DRUGS, 4TH OFFENSE c90 §24(1)(a)(1)",Drugs
MOTOR VEH HOMICIDE OUI--LIQUOR OR .08% c90 §24G(b),Death
"MBOAT, UNSAFE OPERATION OF c90B §8",Other
REGISTRATION LEFT IN TRANSFERRED MV * c90 §2B,Other Registration Violation
"REGISTRATION SUSPENDED, OP MV, SUBSQ.OFF c90 §23",Suspended Registration
REGISTER MV IMPROPERLY TO AVOID TAXES/PREMIUMS c90 §3½(c),Other Registration Violation
"MASS PIKE--STOP/TURN, FAIL SIGNAL *  730 CMR §7.08(17)(c)",Fail to stop/yield/slow/signal
MASS PIKE--CROSS-OVER VIOLATION *  730 CMR §7.08(10)(b),Other
"LICENSE, FALSE APPLICATION FOR MV c90 §24B",Other License Violation
STATE HWAY--TRAFFIC VIOLATION * 720 CMR §9.07,Traffic Violation
SNOWMOBILE OPERATOR REFUSE ID/LEAVE c90B §33,Other
SNOW/REC VEH--UNDER 14 OPERATE UNSUPERVSD c90B §26,Other
STATE HWAY--GUBERNATORIAL BY-LAW VIOL * c85 §23,Other
"OUI-LIQUOR OR .08%, 4TH OFFENSE c90 §24(1)(a)(1)",OUI
MASS PIKE--MARKED LANES VIOLATION *  730 CMR §7.08(8),Improper Lane Change
MASS PIKE--STOP/BACK/U-TURN *  730 CMR §7.08(17)(a)&(b),Other
MASS PIKE TANDEM—SPEEDING 730 CMR §4.18,Speeding
"EMERGENCY VEHICLE, OBSTRUCT STATIONARY * c89 §7C",Obstruct Emergency Vehicle
"LICENSE SUSPENDED FOR OUI, OUI WHILE c90 §23",OUI
MASS PIKE - EXCLUDED AREA IN CONSTRUCTION ZONE *  700 CMR §7.09(12)(b),Other
"UNLICENSED OPERATOR, EMPLOY * c90 §12(a)",No License
"HYPODERMIC, DISTRIB TO UNAUTH PERSON c94C §27(b)",Other
"MASS PIKE--TRAFFIC LIGHT, FAIL OBEY * 730 CMR §7.08(2)",Sign/Signal/Light Violation
CHILD ENDANGERMENT WHILE OUI  c90 §24V,OUI
MASS PIKE--BREAKDOWN LANE VIOLATION *  730 CMR §7.08(9),Traffic Violation
BOAT HOMICIDE BY NEGLIGENT OP c90B §8B(2),Death
BOAT HOMICIDE OUI--LIQUOR OR .08% & NEGLIGENT c90B §8B(1),Death
MDC WATERSHED--MV VIOLATION  350 CMR §11.09,Other
"RMV DOCUMENT, FORGE/MISUSE c90 §24B",Other
"COCAINE, DISTRIBUTE c94C §32A(c)",Drugs
STREETCAR FAIL STOP FOR FIRE APPARATUS c89 §6A,Other
"WATER SKIS/SURFBOARD, NEGLIGENT USE OF c90B §8",Unsafe/Negligent Operation
"SNOW PLOW/HITCH, FAIL REMOVE * c90 §19K",Other
"STREETCAR, OBSTRUCT c161 §94",Other
MDC WAY--$100 VIOLATION * 350 CMR §4.01,Other
MASS PIKE--LEFT LANE RESTRICTION * 730 CMR §7.08(11)(b),Traffic Violation
MASS PIKE--WRONG WAY * 730 CMR §7.05(1),Other
OUI-DRUGS c90 §24(1)(a)(1),Drugs
OUI-LIQUOR OR .08% & SERIOUS INJURY c90 §24L(2),OUI
MOTOR VEH HOMICIDE OUI-LIQUOR OR .08% c90 §24G(b),Death
MANSLAUGHTER WHILE OUI  c265 §13½,Death
MOTOR VEH HOMICIDE OUI-LIQUOR OR .08% & NEGLIGENT c90 §24G(a),Death
"GLASS IN BUILDING, BREAK c266 §114",Other
"MASS PIKE--RIGHT LANE, FAIL KEEP TO *  730 CMR §7.08(13)",Traffic Violation
MOTOR VEH HOMICIDE OUI-LIQUOR OR .08% & RECKLESS c90 §24G(a),Death
"MOTOR VEH, LARCENY OF, SUBSQ.OFF. c266 §28(a)",Other
"OUI-LIQUOR OR .08%, 4th OR GREATER OFFENSE c90 §24(1)(a)(1)",OUI
"OUI-LIQUOR OR .08%, 3RD OFFENSE c90 §24(1)(a)(1)",OUI
"NUMBER PLATE, TAKE c266 §139",License Plate
"HEADLIGHTS, ALTERNATING FLASHING * 540 CMR §22.05(2)",Lights Violation
METAL TIRES +4 MPH ON STATE HWAY * c85 §31,Other
"IGNITION INTERLOCK, OPERATE WITHOUT c90 §24S(a)",Other
"USE MV WITHOUT AUTHORITY, 2ND OFF. c90 §24(2)(a)",Other
"MASS PIKE--TOLL, FAIL PAY *  730 CMR §7.03(3)",Other
"IGNITION INTERLOCK, TAMPER WITH c90 §24T(a)",Other
MOTOR VEH HOMICIDE OUI-DRUGS & NEGLIG c90 §24G(a),Death
MASS PIKE--MINIMUM SPEED VIOLATION * 730 CMR §7.08(6)(c),Other
"MOTOR VEH ODOMETER, TAMPER WITH c266 §141A",Other
"MASS PIKE--TRASH, IMPROP DISPOSE OF MINOR  730 CMR §7.08(24)(a)",Other
"MBOAT ACCIDENT, LEAVE SCENE OF c90B §8",Other
SPEEDING IN CONSTRUCTION ZONE * c90 §17,Speeding
"LICENSE/REGIS/PLATES, REFUSE PRODUCE c90 §25",Other License Violation
"DRUG, PHARMACIST FAIL LABEL c94C §21",Drugs
"STATE HWAY--RAMP, BACK ON/OFF * 720 CMR §9.08",Other
NATIONAL NETWORK TRAVEL LIMITATION VIOL,Other
MOTOR VEH HOMICIDE OUI-DRUGS & RECKLESS c90 §24G(a),Death
MOTOR VEH HOMICIDE OUI-DRUGS c90 §24G(b),Death
"IGNITION INTERLOCK, PERMIT OPERATION WITHOUT c90 §12(c)",Other
MOTORIZED SCOOTER VIOLATION * c90 §1E,Other
"IGNITION INTERLOCK FOR ANOTHER, BYPASS c90 §24U(a)(1)",Other
"EMISSIONS, REGISTER MV WITH IMPROPER c90 §2",Other Registration Violation
"FIRE ALARM, FALSE c269 §13",Other
"DRUG, DISTRIBUTE CLASS B, SUBSQ.OFF. c94C §32A(b)",Drugs
BOAT OUI-LIQUOR OR .08% & SERIOUS INJURY c90B §8A(2),OUI
"OUI-DRUGS, 3RD OFFENSE c90 §24(1)(a)(1)",Drugs
"SNOW/REC VEH--FIREARM, OP WHILE CARRY * c90B §26",Other
"OUI-LIQUOR OR .08%, 5TH OFFENSE c90 §24(1)(a)(1)",OUI
"MOTOR VEH, RECEIVE STOLEN, SUBSQ.OFF. c266 §28(a)",Other
"DRUG, POSSESS CLASS A, SUBSQ.OFF. c94C §34",Drugs
RACING MOTOR VEHICLE BY LICENSED OPERATOR c90 §17B,Other License Violation
RACING MOTOR VEHICLE c90 §17B,Other
"NUMBER PLATE, FAIL RETURN REPOSSESSED MV c90 §6C",License Plate
RMV ID CARD REPLACEMENT VIOL c90 §8G,Other
"OUI-DRUGS, 2ND OFFENSE c90 §24(1)(a)(1)",Drugs
"DRUG, DISTRIBUTE CLASS B c94C §32A(a)",Drugs
MASS PIKE--EQUIPMENT VIOLATON *  730 CMR §7.08(27),Equipment Violation
"LICENSE SUSPENDED, OP MV WITH, SUBSQ. OFF. c90 §23",Suspended/Revoked License
CHILD 8-12 OR OVER 57 INCHES WITHOUT SEAT BELT * c90 §7AA,Seatbelt
CHILD UNDER 8 YEARS & UNDER 58 INCHES WITHOUT CARSEAT * c90 §7AA,Other
"BOAT, REFUSE STOP/ID FOR OFFICER c90B §38",Other
SNOW/REC VEH--OUI--LIQUOR OR .08% * c90B §26,OUI
"LIQUOR, PERSON UNDER 21 PROCURE c138 §34A",Alcohol
"MOBILE PHONE, OPERATOR USE IMPROPERLY * c90 §13",Phone Use
"HORN VIOLATION, MV * c90 §7",Traffic Violation
"CRIME REPORT, FALSE c269 §13A",Other
"EMERGENCY VEHICLE, WILFULLY OBSTRUCT, 3D c89 §7",Obstruct Emergency Vehicle
TOBIN BRIDGE - WEIGHT/SIZE/LOAD/HAZMAT VIOL* 700 CMR §11.05(4)(a),Other
"DRUG PARAPHERNALIA TO MINOR, SELL  c94C §32I(b)",Drugs
MASS PIKE--SPECIAL FUEL VEH OP TOO CLOSE * 730 CMR §7.06(6)(e)(4),Other
"RACING MOTOR VEHICLE BY JR OPERATOR/LEARNER, SUBSQ. OFF. * c90 §17B",Other
USED CAR DEALER FAIL KEEP REGISTER c140 §62,Other Registration Violation
"LICENSE REVOKED AS HTO, OPERATE MV WITH * (CIVIL) c90 §23",Other License Violation
MASS PIKE--MEDIAN/EXCLUDED AREA VIOLATION * 730 CMR §7.08(10)(a),Other
"BOAT, USE WITHOUT AUTHORITY c90B §8(e)(1)",Other
"REGISTRATION, FL SURRENDER ON TRANSFER * c90 §2",Other Registration Violation
LOW-SPEED VEHICLE VIOLATION * c90 §1F,Other
"DRUG, POSSESS CLASS E c94C §34",Drugs
"MASS PIKE--ETC SYSTEM/LANE, UNAUTH USE * 730 CMR §7.04(1)",Other
SNOW/REC VEH--OUI--DRUGS * c90B §26,Drugs
MASS PIKE--HEADLIGHT HIGH BEAM VIOLATION *  730 CMR §7.08(22),Lights Violation
MASS PIKE--SPEEDING TO ENDANGER *  730 CMR §7.08(6)(b),Speeding
"MASS PIKE--POLICE ORDERS, FAIL OBEY *  730 CMR §7.08(1)(b)",Disobey Police
"BOAT, LEAVE SCENE OF PROPERTY DAMAGE BY c90B §8(e)(1)",Other
MASS PIKE--IDLING *  730 CMR §7.08(28),Other
"SCHOOL BUS INSPECTION, FAIL PERFORM POST-TRIP * c90 §7B(17)",Inspection
SNOW/REC VEH--EQUIPMENT VIOLATION * 323 CMR §3.07,Other
MASS PIKE--RESTRICTED AREA VIOLATION *  730 CMR §7.08(11)(a),Other
STATE HWAY--LEFT LANE RESTRICTION VIOL * 720 CMR §9.08(5)(b),Traffic Violation
"MOTOR VEH DOOR, NEGLIGENTLY OPEN c90 §14",Unsafe/Negligent Operation
"SCHOOL BUS, OVERCROWDED c90 §7B",Other
MASS PIKE--PARKING $50 VIOLATION * 730 CMR §7.08(3)&(4),Other
"ELECTRONIC MESSAGE, OPERATOR SEND/READ * c9",Phone Use
MASS PIKE--DISABLED VEH REPAIR/TOW VIOL * 730 CMR §7.08(18),Other
MOTORCYCLE PASSENGER VIOLATION * c90 §7,Other
"MASS PIKE--HEIGHT WARNING SIGNAL, IGNORE *  730 CMR §7.08(19)",Other
MASS PIKE--FALLING DEBRIS * 730 CMR §7.05(5)(f),Other
MASS PIKE--SIZE VIOLATION * 730 CMR §7.05(5)(i),Other
MASS PIKE--PILOT CAR VIOLATION *  730 CMR §7.06(4)(d),Other
"MASS PIKE--WILLIAMS TUNNEL, UNAUTH USE OF * 730 CMR §7.05(4)",Other
"MASS PIKE--REDUC LOAD PERMIT, FL CARRY *  730 CMR §7.06(3)(c)(3)",Other
MASS PIKE--NEGLIGENT OP IN CONSTRUCTION ZONE *  730 CMR §7.08(12)(c),Unsafe/Negligent Operation
"MASS PIKE--LOADING, NEGLIGENT * 730 CMR §7.08(5)(b)",Unsafe/Negligent Operation
MASS PIKE--PARKING $100 VIOLATION * 730 CMR §7.08(3)&(4),Other
MASS PIKE--ENTER/EXIT IMPROPERLY * 730 CMR §7.08(7),Other
MASS PIKE--WINDOW OBSTRUCTED * 730 CMR §7.05(5)(c),Equipment Violation
"MASS PIKE--TRASH, IMPROP DISPOSE OF MAJOR  730 CMR §7.08(24)(b)",Other
MASS PIKE--EXCLUDED AREA IN CONSTRUCTION ZONE * 730 CMR §7.08(12)(b),Other
"SCHOOL BUS, USE MOBILE PHONE WHILE OPERATING* c90 §7B",Phone Use
"MASS PIKE--ENTER/EXIT, UNAUTHORIZED * 730 CMR §7.05(3)",Other
MASS PIKE TANDEM—CLOSER THAN 500 FT 730,Other
MASS PIKE--WRONG WAY IN CALLAHAN/SUMNER TUNNEL *  730 CMR §7.05(2),Other
"MOBILE PHONE, OPERATOR UNDER 18 USE * c90 §8M",Phone Use
MASS PIKE--TIRE VIOLATION *  730 CMR §7.05(5)(b),Other
SNOW/REC VEH--NOISE VIOLATION * c90B §24,Other
"MASS PIKE - EZDRIVEMA SYSTEM TOLL, AVOID * 700 CMR §7.04(3)",Other
